{
  "contract_version": "1.0.0",
  "producer": "azure-devops",
  "consumer": "spec-writing",
  "artifact_type": "ado-normalized",
  "mode": "pr-comments",
  "source": {
    "platform": "azure-devops",
    "organization": "aveato",
    "project": "Laekker.Kitchen",
    "repository_id": "Laekkerai.Ordering",
    "pull_request_id": 8123,
    "work_item_id": null,
    "read_only": true
  },
  "normalization": {
    "status": "pass",
    "missing_fields": [],
    "warnings": [],
    "html_stripped": true,
    "secret_redactions_applied": true
  },
  "work_item": {},
  "pull_request": {
    "id": 8123,
    "title": "Extract checkout validation helper",
    "source_branch": "refs/heads/feature/checkout-validation",
    "target_branch": "refs/heads/main",
    "status": "active",
    "creation_date": "2026-04-28T08:00:00Z",
    "closed_date": null
  },
  "linked_work_items": [
    {
      "id": 1234,
      "title": "Checkout supports discount codes",
      "type": "User Story",
      "state": "New",
      "url": "https://dev.azure.com/aveato/Laekker.Kitchen/_apis/wit/workItems/1234"
    }
  ],
  "pr_comments": [
    {
      "thread_id": 99,
      "comment_id": 501,
      "parent_comment_id": 0,
      "author": "Reviewer",
      "content": "Please extract this validation to a helper.",
      "file_path": "/src/order.ts",
      "side": "right",
      "start_line": 44,
      "end_line": 48,
      "start_offset": 1,
      "end_offset": 20,
      "thread_status": "active",
      "thread_is_deleted": false,
      "comment_is_deleted": false,
      "published_date": "2026-04-29T08:00:00Z",
      "last_updated_date": "2026-04-29T08:00:00Z"
    }
  ]
}
