{
  "contract_version": "1.0.0",
  "producer": "azure-devops",
  "consumer": "spec-writing",
  "artifact_type": "ado-normalized",
  "mode": "work-item",
  "source": {
    "platform": "azure-devops",
    "organization": "example-org",
    "project": "example-project",
    "repository_id": "",
    "pull_request_id": null,
    "work_item_id": 1234,
    "read_only": true
  },
  "normalization": {
    "status": "pass",
    "missing_fields": [],
    "warnings": [],
    "html_stripped": true,
    "secret_redactions_applied": true
  },
  "work_item": {
    "id": 1234,
    "type": "User Story",
    "title": "Checkout supports discount codes",
    "description": "Add discount code support to checkout.",
    "acceptance_criteria": "Given a valid code, when checkout is submitted, then the discount is applied.",
    "repro_steps": "",
    "system_info": "",
    "tags": "checkout;discount",
    "state": "New",
    "comments": [],
    "history": [
      {
        "update_id": 17,
        "revision": 4,
        "revised_by": "Casey Smith",
        "revised_date": "2026-10-01T12:00:00Z",
        "changed_fields": [
          {
            "reference_name": "System.State",
            "old_value": "New",
            "new_value": "Active"
          }
        ]
      }
    ],
    "related_work": [
      {
        "rel": "System.LinkTypes.Related",
        "url": "https://dev.azure.com/example-org/example-project/_apis/wit/workItems/5678",
        "attributes": {"name": "Related"}
      }
    ]
  },
  "pr_comments": [],
  "pull_request": {},
  "linked_work_items": []
}
